FoodName,Breakfast,Lunch,Dinner,Calories,Fat,Cholesterol,Sodium,Carbohydrates,Fiber,Sugar,Protein,Vitamin_A,Vitamin_C,Calcuim,Iron,Picture,Ingredient,Step By Step Cooking Method
Champorado : Sweet chocolate rice porridge,1,0,1,213,0.2,0,1.7,50,0,19,2.5,0,0,0,0,,8 tbsp cocoa powder | 1 cup glutinous rice | 1/2 cup sugar | 3 1/2 cups water | condensed milk,"1) Pour 2 1/2 cups of water in a pot and bring to a boil | 2) Put-in the glutinous rice and allow water to re-boil for a few minutes | 3) Dilute the cocoa powder in 1 cup warm water then pour-in the pot. Stir continuously | 4) Once the glutinous rice is cooked (about 12 to 18 minutes of cooking with constant stirring), add the sugar and cook for another 5 minutes or until the texture becomes thick | 5) Remove from the pot and place in a serving bowl | 6) Serve hot with a swirl of condensed milk on top"
Bibingka : Rice cake,1,0,0,110,0,0,410,25,0,2.9,2,4,0,0.7,0.7,,¾ Cup Cake Flour | ¼ Cup Rice Flour | 1 Cup Sugar | 1 Tbsp. Baking Powder | 1 Cup Coconut Milk | ¼ Cup Melted Margarine | Plus Extra For Brushing | 2 Pcs. Eggs | 1 Bar Eden Cheese Original Grated,"1) Line each pan with Banana leaf then grease with melted butter. Set aside | 2) For the Bibingka mixture: Sift together Cake flour, Rice flour, Sugar and baking powder. Add in the coconut milk, melted margarine, eggs and grated Eden Original. Mix until blended | 3) Pour Bibingka mixture onto the prepared pans. Top with sliced Salted Egg | 4) Steam for 15-20 minutes or until the center is firm. Let it cool | 5) Slightly grill the bottom part over low flame | 6) Brush with melted margarine then top with Eden Original
 strips and granulated sugar. | 7) Optional: To make the top golden brown in color, bake for at least 3-5 minutes using an oven toaster."
Arroz Caldo : Broth rice,1,0,1,684,44,224,1629,39,1.5,,35,,0,5.8,0.1,,2 tablespoons olive oil | 1 onion diced | 2 cloves garlic crushed | 1 (2 inch) piece fresh ginger | peeled and thinly sliced | 2 ¼ pounds chicken wings split and tips discarded | 1 tablespoon fish sauce (Optional) | 5 ¼ cups chicken broth | 1 cup glutinous sweet rice | salt and pepper to taste | 1 green onion chopped | 1 lemon sliced (Optional) | 1 teaspoon fish sauce for sprinkling if desired (Optional),"1) Heat oil in a large pot over medium heat. Cook and stir onion garlic and ginger in hot oil until fragrant about 5 minutes. Add chicken wings; cook and stir for 1 minute. Stir in fish sauce, cover, and cook another 2 minutes. | 2) Pour chicken broth into the pot. Stir in sweet rice and bring mixture to a boil. Cover and cook for 10 minutes, stirring occasionally to prevent rice from sticking to the bottom of the pot. Season with salt and pepper. | 3) Portion soup into bowls and garnish with green onion. Serve with lemon slices and additional fish sauce, if desired"
Tapsilog : Fried marinated beef slices with egg,1,0,0,467,7,247,91,50,1,4,20,0,0,0,0,,1 lb. beef sirloin sliced thinly | 3 pieces eggs | 6 tablespoons cooking oil,"1) Prepare the tapa by placing the beef in a large bowl. Combine with all the tapa marinade ingredients. Mix well and cover the bowl. Place inside the fridge and marinate overnight. | 2) Cook the garlic fried rice (sinangag na kanin) by heating 3 tablespoons cooking oil in a pan. Add crushed garlic. Cook until garlic turns light brown. Add the leftover rice. Stir-fry for 3 minutes. | 3) Season with salt. Continue to stir-fry for 3 to 5 minutes. Set aside. | 4) Start to cook the tapa. Heat a pan and pour the marinated beef into it, including the marinade. Add ¾ cups water. Let the mixture boil. Cover the pan and continue to cook until the liquid reduces to half. Add 3 tablespoons cooking oil into the mixture. Continue to cook until the liquid completely evaporates. Fry the beef tapa in remaining oil until medium brown. Set aside. | 5) Fry the egg by pouring 1 tablespoon oil on a pan. Crack a piece of egg and sprinkle enough salt on top. Cook for 30 seconds. Pour 2 tablespoons water on the side of the pan. Cover and let the water boil. Continue to cook until the egg yolks gets completely cooked by the steam. | 6) Arrange the beef tapa, sinangag, and fried egg on a large plate to form Tapsilog. Serve with vinegar as dipping sauce for tapa. | 7) Enjoy with half cup of warm rice."
Lugaw : Porridge,1,0,1,383,19,71,1592,23,1,0,28,2,0.2,0.3,0.2,,1 cup long grain white rice | 4 to 5 cups water | 2 teaspoons salt | 1/4 cup rousong pork floss,"1) Pour water in a cooking pot. Bring to a boil. | 2) Put-in the rice. Continue cooking for 30 minutes or until the texture becomes thick, while stirring once in awhile. | 3) Add the salt, stir and then cook for 2 minutes more. | 4) Transfer to a serving bowl. Top with a tablespoon of rousing. | 5) Serve hot. Share and enjoy!"
Tocino : Bacon,1,1,0,257,6.3,48,814,5.9,0.2,4.9,17,0,0.7,0.1,0.5,,"2 pounds pork butt, sliced to 1/4-inch thick | 1 cup sugar | 1 tablespoon salt | 1 tablespoon garlic powder | 1/4 teaspoon pepper | 2 drops red food coloring | 1 cup water | 2 tablespoons canola oil","1) In a bowl, combine pork, sugar, salt, garlic, pepper, and red food coloring. Massage meat with curing mixture until well-distributed and evenly colored. | 2) Store in a covered container or ziplock bag and refrigerate overnight to cure. | 3) In a pan over medium heat, add pork including marinade and enough water to cover. Bring to a boil. | 4) Lower heat, cover and simmer until meat is tender and cooked through, adding more water in 1/2 cup increments as needed. | 5) When water is completely absorbed and meat is tender, add oil and cook, stirring regularly, until meat caramelizes. Serve hot. | 6) Enjoy with half cup of warm rice."
Cornsilog : Corned beef and garlic fried rice,1,0,0,365,6.3,20,688,32,1.8,1.2,153.1,4.1,19.5,0.3,0.9,,1 12 oz. can corned beef | 1 medium yellow onion | 3 cloves garlic crushed | 3 cups sinangag | 3 eggs | 4 tablespoons cooking oil | ½ cup beef broth | Salt and pepper to taste,"1) Heat oil on a pan. Once the oil gets hot, crack an egg and fry sunny-side-up. Remove the fried egg and place in a plate. Do this step until all 3 eggs are cooked. | 2) Using the remaining oil, sauté the garlic until it turns medium brown. Add the onion and sauté until it softens. | 3) Add the corned beef. Sauté for 2 minutes | 4) Pour the beef broth in the pan. Continue to cook for 2 to 3 minutes or until the liquid evaporate. Add salt and pepper to taste. | 5) Arrange a cup of sinangag (garlic fried rice) and a piece of egg on a plate. Put 1/3 of the cooked corned beef. Do this step on all 3 plates. Serve. | 6)  Enjoy with half cup of warm rice."
Tortang Talong : Eggplant omelette,1,1,1,250,9.4,93,113,13.2,7.7,5.5,5,0.3,0.8,0.3,0.05,,4 pieces Chinese eggplant | 2 pieces raw eggs | 1 teaspoon salt | 6 tablespoons cooking oil,1) Grill the eggplant until the color of skin turns almost black | 2) Let the eggplant cool for a while then peel off the skin. Set aside. | 3) Crack the eggs and place in a bowl | 4) Add salt and beat | 5) Place the eggplant on a flat surface and flatten using a fork. | 6) Dip the flattened eggplant in the beaten egg mixture | 7) Heat the pan and pour the cooking oil | 8) Fry the eggplant (that was dipped in the beaten mixture). Makes sure that both sides are cooked. Frying time will take you about 3 to 4 minutes per side on medium heat. | 9)  Enjoy with half cup of warm rice.
Tosilog : Local bacon with fried rice and egg,1,0,0,386,6.4,273,298,23.4,0.3,9.2,31,7.3,0.3,0.4,13,,1 lb. uncooked tocino | 3 cups sinangag | 3 sunny-side up eggs | 2 cups water | 1/4 cup cooking oil,"1) Boil the water in a cooking pot. | 2) Once the water starts to boil, pour-in the cooking oil and add the uncooked tocino. Boil in medium heat until the water evaporates. | 3) Once the water completely evaporate, the oil will be left behind. Let one side of the tocino cook in oil for 3 minutes. Flip the tocino and cook the other side for the same time. | 4) Arrange the cooked tocino with the eggs in individual plates. | 5) Meanwhile, remove the excess oil in the cooking pot where the tocino was cooked. Heat the same pot and put-in the sinangag. Cook the fried rice for 1 minute while tossing. The residue from the tocino will stick to the fried rice making it more tasty. | 6) Arrange the fried rice with the tocino in individual plates. | 7) Serve with spiced vinegar. | 8)  Enjoy with half cup of warm rice."
Daing na Bangus : Fried milkfish dish,1,1,0,324,26.1,0,709.6,5.1,0,0,16.6,0,0,0.4,0.1,,1 medium sized milkfish cleaned and scales removed | 10 tablespoons white or cane vinegar | 1 teaspoon crushed peppercorn | 1 head garlic crushed | 1/4 teaspoon cayenne pepper powder optional | 1/2 teaspoon coarse sea salt | 1/2 cup cooking oil,"1) Combine vinegar, pepper, salt, garlic, and cayenne pepper powder in a bowl. Stir to mix the ingredients. Set aside. | 2) Butterfly the bangus (slice from the top) and the place it inside a large re-sealable plastic bag. | 3) Pour the vinegar mixture in the bag and then let all the air out. Seal the bag and refrigerate overnight. | 4) Remove the fish from the bag and let the liquid drip. | 5) Heat the cooking oil in a pan. Once the oil gets hot, fry the fish in medium heat until one side gets crisp. Turn it over and repeat the process on the other side. | 6) Remove from the pan and place in a serving plate. Serve with bowl of spicy vinegar. | 7)  Enjoy with half cup of warm rice."
Igado : Filipino spiced pork liver dish ,1,1,0,196,13.2,0,375.5,5.6,0.5,0,13.7,0,0,0.2,0.1,,1/2 lbs. pork tenderloin sliced into 2-inch strips | 1/2 lb. pork liver sliced into 2-inch strips | 1/2 lb. pork kidney | 1 Knorr Pork Cube | 1 red bell pepper cut into strips | 1/2 cup green peas | 1 carrot julienne | 3 laurel leaves | 1 onion minced | 5 cloves garlic minced | 6 tablespoons soy sauce | 5 tablespoons white vinegar | 1 1/4 cup water | 4 tablespoons cooking oil | Salt and pepper to taste,"1) Boil the kidney with 4 thumbs of ginger for at least 30 minutes. Let it cool down and slice into 2-inch strips. Set aside. | 2) Heat 2 tablespoons of cooking oil in a pan. Sauté the pork liver for 2 minutes. Remove from the pan and set aside. | 3) Pour the remaining oil in the pan. Once hot, sauté garlic and onion until the latter softens. | 4) Add the pork kidney. Cook for 1 minute. | 5) Add the pork tenderloin. Sauté until the outer layer turns light brown. | 6) Pour the soy sauce and vinegar into the pan. Let the liquid boil. Stir. | 7) Add the laurel leaves and pour water. Let boil. Reduce the heat between low to medium setting. Continue cooking for 40 minutes. | 8) Add Knorr Pork Cube. Cook for 8 minutes. | 9) Add the liver back into the pan. Stir and continue cooking for 3 minutes. | 10) Put the bell pepper, carrot, and green peas. | 11) Season with salt and ground black pepper. Cook for 2 minutes.Transfer to a serving bowl. Serve hot with rice. | 12) Share and enjoy!
"
Filipino Chicken Curry,1,1,1,243,11,74,73,7.5,1.5,2,28,11,0.8,0.3,11,,2 1/2 lbs. chicken cut into serving pieces | 1 pack Knorr Ginataang Gulay Mix 45 grams | 2 pieces baking potato cubed | 2 pieces red bell pepper sliced into squares | 3/4 cup chopped celery | 2 pieces red onions chopped | 3 cloves garlic chopped | 1 1/2 tablespoons curry powder | 3 pieces long green chili pepper | 4 tablespoons cooking oil | 2 cups water | 1 1/2 teaspoons fish sauce | 1/4 teaspoon ground black pepper,"1) Heat oil in a pot. Pan fry the chicken pieces for 1 ½ to 2 minutes per side. Remove the chicken from the cooking pot. Set aside. | 2) Combine Knorr Ginataang Gulay recipe Mix with 2 cups water. Stir until well blended. Set aside. | 3) Heat remaining oil on the pot. Saute onion and garlic. Add the celery. Continue to cook until onion and celery softens. | 4) Pour the gata mixture into the pot. Let boil. | 5) Add curry powder. Stir until the powder totally dilutes in coconut milk. | 6) Put the pan-fried chicken into the pan. Cover and cook in medium heat for 30 to 35 minutes or until tender. | 7) Add red bell pepper, long green pepper, and potato. Cover the pot and cook for 5 to 8 minutes. | 8) Add fish sauce and ground black pepper. Stir. | 9)  Enjoy with half cup of warm rice."
Filipino Style Tilapia Escabeche : Filipino style sweet and sour fish dish,0,1,1,558,43,68,83,8.5,0.9,1.4,22,,0.4,0.2,13,,"1 large fish 1 to 2 lbs, cleaned and salted | 1 medium red bell pepper sliced into strips | 1 medium red onion sliced | 1 cup white vinegar | 5 cloves garlic crushed | 1 teaspoon whole peppercorn | 1/2 teaspoon salt | 1/4 cup sugar | 1/2 cup cooking oil","1) Heat cooking oil in a frying pan then fry both sides of the fish until a bit crispy. Set aside. | 2) Heat a clean pan and pour-in the vinegar. Let boil. | 3) Add sugar, whole peppercorn, and garlic. Cook for 1 minute. | 4) Put-in the onion and red bell pepper. Stir and cook until the vegetables are tender. | 5) Sprinkle salt and then stir. | 6) Put-in the fried fish. Cook for 2 to 3 minutes. | 7) Turn-off heat and transfer to a serving plate. | 8)  Enjoy with half cup of warm rice."
Chicken Gising - gising : Chicken wake-up dish,1,1,1,210,56,0,220,27,1,10,3,0,0,0,0,,"2 lbs. chicken cut into serving pieces | 90 grams Knorr Ginataang Gulay Mix | ½ lb. winged bean sigarilyas, sliced | 2 long green chili pepper sliced | 5 Thai chili pepper optional | 1 tablespoon shrimp paste | 3 cups water | 1 onion chopped | 5 cloves garlic chopped | 2 thumbs ginger chopped | 3 tablespoons cooking oil","1) Heat oil in a pan. Sauté garlic, onion, and ginger. | 2) Add chicken pieces. Stir fry until the exterior turns light brown in color. | 3) Add 1 cup water. Let boil. | 4) Combine Knorr Ginataang Gulay Mix with 2 cups water. Mix well and then pour into the pan. Cover and continue cooking between low to medium heat setting for 20 minutes. | 5) Add shrimp paste, long green pepper, and winged beans. Cover the pan and continue cooking for 5 minutes. | 6) Add Thai chili peppers if desired. Cook for 2 minutes more. | 7) Transfer to a serving bowl. Serve hot with rice. | 8)  Enjoy with half cup of warm rice."
"Ginataang Hipon Sitaw at Kalabasa : Coconut Milk Stew Long Beans, Squash and shrimp",0,1,0,220,15,67,213,9,1,5,14,0,0,0,0,,1 lb shrimp cleaned | 2 cups coconut milk | 2 pieces long green chili sliced | 2 pieces long red chili or about 6 pieces Thai chili sliced | 1 tablespoon ginger minced | 1 medium onion chopped | 3 teaspoons garlic minced | 1 1/2 tablespoons fish sauce | 1/3 teaspoon ground black pepper | 2 tablespoons cooking oil,"1) Heat oil in a pan | 2) Sauté onion, ginger, and garlic | 3) Add ground black pepper and fish sauce. Cook for 30 seconds. | 4) Pour-in coconut milk. Let boil and reduce to half. Note: this is done by letting coconut milk evaporate by boiling in medium heat in about 20 to 25 minutes. | 5) Put-in shrimps. Cook for 5 to 7 minutes. | 6) Add green and red chilies. Cook for 5 minutes. | 7) Turn-off heat and then transfer to a serving plate | 8)  Enjoy with half cup of warm rice."
Hardinera (Jardinera) : Quezon meatloaf,1,1,1,160,7,2,75,21,0,0,2,0,0,0,0,,1 1/2 lb ground pork | 1 1/2 cups potatoes diced | 1 cup carrots diced | 8 ounces tomato sauce | 6 cloves garlic crushed | 1 medium-sized onion minced | 1 teaspoon granulated sugar | 1 piece beef or pork cube | 4 boiled eggs shelled (optional) | Salt and pepper to taste | 3 tablespoons cooking oil | 1 cup water,"1) Heat a cooking pot and pour-in the cooking oil. | 2) When the oil is hot enough, put-in the garlic and sauté until the color turns light brown. | 3) Add the onions and sauté until the texture becomes soft. | 4) Put-in the ground pork and cook for 5 minutes. | 5) Add the beef or pork cube, tomato sauce, and water and let boil. Simmer for 20 minutes. | 6) Put the carrots and potatoes in then stir until every ingredient is properly distributed. Simmer for 10 to 12 minutes.Add salt, ground black pepper, and sugar then stir. | 7) Put in the boiled eggs and turn off the heat. | 8) Transfer to a serving bowl and serve | 9) Share and enjoy!"
Pancit Palabok : Filipino noodles topped with orange sauce,1,1,0,395,9,135,536,39,0,0,17,0,0,0,0,,1 1/2 lb ground pork | 1 1/2 cups potatoes diced | 1 cup carrots diced | 8 ounces tomato sauce | 6 cloves garlic crushed | 1 medium-sized onion minced | 1 teaspoon granulated sugar | 1 piece beef or pork cube | 4 boiled eggs shelled (optional) | Salt and pepper to taste | 3 tablespoons cooking oil | 1 cup water,"1) Heat a cooking pot and pour-in the cooking oil. | 2) When the oil is hot enough, put-in the garlic and sauté until the color turns light brown. | 3) Add the onions and sauté until the texture becomes soft. | 4) Put-in the ground pork and cook for 5 minutes. | 5) Add the beef or pork cube, tomato sauce, and water and let boil. Simmer for 20 minutes. | 6) Put the carrots and potatoes in then stir until every ingredient is properly distributed. Simmer for 10 to 12 minutes. | 7) Add salt, ground black pepper, and sugar then stir. | 8) Put in the boiled eggs and turn off the heat. | 9) Transfer to a serving bowl and serve.| 10) Share and enjoy!"
Kalderetang Kambing : Goat stew,0,1,0,160,9,0,230,17,1,1,2,3,0,0,0,,"1 lb goat meat chevon, cubed | 1 tablespoon garlic minced | 1 onion minced | 3 tomatoes diced | 4 Thai chili optional | 1 cup tomato sauce | 3/4 cup bell pepper sliced | 6 tablespoon liver spread | 3/4 cup green olives optional | 1/2 cup vinegar | 1 carrot cubed | 1 potato cubed | 3 tablespoons cooking oil | 2 cups water | Salt and pepper to taste","1) Combine the vinegar, salt, and ground black pepper in a large bowl then marinate the goat meat for at least an hour (This should eliminate the gamey smell and taste of the meat) then separate the meat from the marinade. | 2) Pour the cooking oil in a cooking pot or casserole and apply heat. | 3) Sauté the garlic, onion, and tomatoes | 4) Add the marinated goat meat then cook until the color of the outer part turns light brown | 5) Put-in the tomato sauce and crushed chili then allow to cook for 2 minutes | 6) Add the water and allow to boil. Simmer for at least 45 minutes or until the meat is tender. | 7) Add the liver spread and cook for 5 minutes (You may add water if the sauce seems to dry up) | 8) Put-in the potatoes and carrots then simmer for 8 minutes. | 9) Add the olives and bell pepper then simmer for another 5 minutes. | 10) Add salt and pepper to taste. | 11) Serve hot. Share and enjoy!"
Ginisang Repolyo : Sauteed Cabbage,1,1,1,167,9,28,317,10,2.5,3.5,11,5.2,16,0.3,0.6,,1 medium cabbage chopped | 4 ounces pork sliced | 1 medium yellow onion sliced | 1 small red bell pepper sliced | 4 cloves garlic crushed and minced | 3 tablespoons cooking oil | 1 cup beef broth | Salt and pepper to taste,"1) Heat the cooking oil in a pan. | 2) Once the oil becomes hot, saute the garlic and onion. | 3) Put-in the pork and then cook for 5 minutes or until color turns medium brown.Pour-in half of the beef broth. Let boil and simmer until the liquid totally evaporate. | 2) Put-in the cabbage. Cook for 1 to 2 minutes. | 3) Add the red bell pepper. Stir and cook for 1 minute more. | 4) Add salt and pepper to taste. | 5) Pour-in remaining beef broth. Let boil. Stir. | 6) Transfer to a serving bowl. | 7) Serve. Share and enjoy!"
Ginisang Pechay at Tuna : Sauteed cabbage and tuna,1,1,1,185,7,0,752,2,0.5,0,14,0,0,0,0,,1 tbsp oil | 1 pc onion chopped | 1 clove garlic chopped | 1 can tuna (180 g) | 1 Knorr Chicken Cube | 1 bundle pechay sliced | 1 cup water,"1) In a medium pan, start by getting the pan nice and warm at medium-high heat. Add the oil then sauté the garlic and onions until soft and aromatic. | 2) Add the tuna and the crushed Knorr Chicken Cubes. Sauté for 2 minutes or until completely dissolved. | 3) Add the pechay leaves and water, then let it simmer for an additional 2-3 minutes."
Sinangag Garlic Rice : Fried garlic rice,1,0,0,279,9,0,294,45,0.1,0,3.8,0,0.2,0.7,0.2,,6 cups leftover white rice | 1 head garlic crushed | 4 tablespoons cooking oil | 1 teaspoon salt,1) Combine rice and salt. Gently mix until well blended. | 2) Heat oil in a pan. | 3) Add garlic. Cook until light to medium brown. | 4) Put half of the rice in the pan. Stir-fry for 1 minute. | 5) Add the remaining rice. Continue to stir-fry for 5 to 6 minutes. | 6) Transfer to a serving plate. | 7) Serve. Share and enjoy!
Ginataang Tahong : Mussels cooked in Coconut Milk,0,1,0,240,25,2,213,10,0,0,5,0.4,0.2,0.3,0.2,,1 lb. mussels cleaned | 2 cups coconut milk | 2 cups chopped spinach | 2 tablespoons fish sauce | 5 cloves garlic crushed | 1 medium onion minced | 3 tablespoons ginger cut in thin strips | 1/2 teaspoon ground black pepper | 2 pieces birds eye chili optional | 3 tablespoons cooking oil,"1) Heat the cooking oil in a cooking pot. | 2) Sauté the garlic, onion, and ginger | 3) Add the fish sauce, ground black pepper, and chili. Stir. | 4) Pour-in the coconut milk. Let boil. | 5) Let the coconut milk reduce to half and then add the spinach. Cook for 1 minute. | 6) Put-in the mussels. Stir and then cook for 3 to 5 minutes. | 7) Serve with steamed rice. Share and enjoy!"
"Togue Guisado : Sauteed Mung Bean Sprout with carrots, bell pepper, shrimp, and tofu",1,1,0,67,2.4,0,304,5.2,1.3,1.4,7.9,51,12,0.5,0.6,,12 ounces mung bean sprout | 8 ounces tofu extra firm | 1 piece carrot julienne | 12 pieces shrimp head and scales removed | 1 piece tomato cubed | 1 piece onion chopped | 4 cloves garlic minced | 1 piece red bell pepper cut into strips | 1 piece green bell pepper cut into strips | 2 tablespoons oyster sauce | Ground black pepper to taste | 1 1/4 cups cooking oil,"1) Fry the tofu until color turns golden brown then set aside. (slice the tofu into cubes) | 2) Sauté the garlic, onion, and tomato. | 3) Once the onion and tomato softens, add the shrimp. Saute for 1 minute. | 4) Add the tofu. Cook for 30 seconds. | 5) Add the mung bean sprouts and carrot. Saute for 1 minute. | 6) Add the bell peppers. Cook for another minute. | 7) Season with oyster sauce and ground black pepper. | 8) Serve hot with rice. Share and enjoy!"
Inihaw Na Salmon : Grilled salmon,0,1,0,123,1.33,85,392,0.31,0,0.09,26,0.3,0.2,0.1,0.2,,"1/2 kg. salmon, steak cut | 2 -4 tbsp Knorr Liquid Seasoning | 4 tbsp calamansi juice | black pepper to season","1) All you need to do is to marinate the salmon steaks in a mixture of Knorr Liquid Seasoning, calamansi juice, and pepper for at least 10 minutes before cooking. |  2) Grill over hot coals or pan-fry the fish until the fish is cooked through. An inch of salmon will cook for about 8 – 10 minutes, around 3 - 4 minutes per side. Make sure to monitor well to avoid overcooking it. You will know if the Salmon is ready if you see a white substance, similar to cooked egg whites, coming out of the fish. | 3) Serve with your preferred sautéed vegetables, rice, and condiment of choice. Serve to your family and see how they will crave for more of this dish!"
Utan Bisaya : Boiled vegetables,0,1,1,160,1,1,282,37,12,14,7,0.2,0.2,0.2,0.2,,3/4 lb squash | 2 pieces taro | 1 piece Knorr Shrimp Cube | 4 thumbs ginger | 2 stalks lemongrass | 1 piece Chinese eggplant sliced | 10 pieces string beans cut in 2 inch pieces | 12 pieces okra | 2 cups spinach | 3 1/2 cups water | Salt and ground black pepper to taste,"1) Boil water in a cooking pot. Add lemongrass and ginger. Cook for 5 minutes. | 2) Add taro and squash. Cover and continue boiling for 5 to 7 minutes. | 3) Remove lemongrass from the pot. Add okra, string beans, and eggplant. Stir. Cover and continue cooking for 7 minutes. | 4) Add Knorr Shrimp Cube. | 5) Stir and cook for 3 minutes. | 6) Add spinach. Cook for 2 minutes. | 7) Season with salt and ground black pepper. | 8) Transfer to a serving bowl. Serve. | 9) Share and enjoy!"
Kangkong At Tokwa in Oyster Sauce : Water spinach and tofu in oyster sauce,0,1,1,240,11,0,0,35,3,6,1,0.4,0.2,0.2,0,,1 bunch kangkong | 1 package (12 ounces) firm tofu | 1/2 cup canola oil | 2 tablespoons oyster sauce | 1/4 cup water | 1 tablespoon chili garlic sauce | 1 teaspoon sesame oil | 1 teaspoon cornstarch | 1 peeled and sliced thinly,"1) Drain tofu from packing liquid. Pat dry with paper towels to absorb moisture. Cut into 1/2- inch cubes. | 2) Trim about 2 inches from the kangkong stalks and discard. Cut kangkong into 3-inch lengths, separating the sturdier stalks from the leaves. Wash thoroughly and drain well. | 3) In a bowl, combine oyster sauce, chili garlic sauce, water, sesame oil and cornstarch. Stir until well-blended and set aside. | 4) In a wide skillet over medium heat, heat oil until hot. Add tofu and cook until golden and crispy. Remove from pan, drain excess oil on paper towels and keep warm. | 5) Remove excess oil from the pan except for about 2 tablespoons. add onions and cook until softened. | 6) Increase heat to high. Add sauce mixture and cook until bubbly, stirring until thickened. | 7) Add sturdy stalks and cook for about 30 seconds or until half done. | 8) Add kangkong leaves and cook, stirring regularly, for another 30 seconds or until tender yet crisp. | 9) Add tofu and quickly toss until lighted coated with sauce. | 10) Season with salt and pepper to taste. Serve hot."
