Sweet and sour chicken,0,1,1,177,0.5,13.7,1228.2,37.3,2.5,27.8,8,2.7,0,2.5,7.3,,1 pound skinless boneless chicken breasts cut into 1 inch pieces | 20 ounce can pineapple chuncks | 1/4 cup soy sauce | 1 cup green onion cut into pieces | 1 large green pepper cut into strips | 3 TBS honey | 1 tsp ginger | 1 tsp garlic (or to taste),"1) Drain pineapple and set aside the juice. | 2) In a saucepan heat juice, soy sauce, honey, ginger, and garlic for about 5 minutes and then add in the chicken and cook for 10 minutes or until chicken is fully cooked. | 3)Turn the heat on low and add in the pineapple chunks, simmer for about 5 minutes. | 4) Remove from heat, stir and serve."
"Stir Fried Okra, Onion, Pepper, Eggplant",1,1,0,426,33.8,0,17.5,30.1,7.5,4.1,5.4,10.5,0,11.7,7.6,,"1 cup Onions chopped | 1/2 cup Bell Peppers chopped | 1 1/2 cup Okra chopped | 1 1/2 cup Eggplant pealed & chopped | 3 T cornmeal | 1/3 cup Canola Oil,Salt & Pepper to taste","1) Chop all veggies. Have oil hot and add onions & peppers. | 2) Mix half cornmeal wth okra, coatng well.  | 3) Add to skillet. Add other half cornmeal to eggplant,coating well. | 4) Add to skillet. Stiring mixture often, | 5) Cook till tender and somewhat brown. Add salt & pepper to taste."
Giniling : Grounded meat,1,1,0,223,8.7,0,571.7,27,6,5.2,11.2,12.7,0,7.2,25.4,,"1/2 cup Yves Veggie ground (or ground beef sirloin for lesser fat) | 1 Tbsps Grapeseed oil | 1 small slice onion | 1/4 tsp garlic powder or garlic clove | 1 small potatoes cubed | 1Tbsp red bell pepper diced | 1/4 c carrots, diced |1/4 c pimento stuffed olives | 1/4 c green peas thawed | 1 Tbsp tomato paste | 3.4 tsp soy sauce | 2 Tbsp white wine | 3/4 tsp apple cider vinegar | 1 small bay leaf | 1/4 tsp smoked paprika | 1/4 tsp ground cumin | 1/4 tsp dried oregano | 1/4 tsp ground cinnamon | 1/4 tsp sugar Splenda | Salt and pepper to taste | Parsely for garnish","1) Heat your oil in a deep skillet. When hot, saute onions till translucent. Then add garlic. | 2)  Saute for a minute and then add the meat. Cook meat till its done (when brown). | 3) Add the potatoes and the carrots. Season with a bit of salt and pepper. Be careful with your salt since you will be adding soy sauce later on. | 4) Cover the meat mixture and let it simmer for just 2-3 minutes. | 5) Then add the wine. Let is simmer for another 3 minutes or until the wine has reduced to half i ts amount. | 6) Then add the vinegar and the next 9 ingredients (thru sugar) | 7) Cover and simmer until the potatoes are cooked. | 8) When potatoes are done, adjust seasoning (add more according to your taste). | 9)  Add the red bell peppers and the peas just before turning off the heat. | 10)  Serve with steamed white rice, or yellow rice. Garnish with chopped parsely/cilantro."
Stir fried long beans and eggplant,1,1,0,109,5.2,0,658.6,15.4,5.2,3.1,3.4,10.3,26,4.2,6.6,,"Eggplant 2 cup (1"" cubes) | Chinese Long Beans 2 cup (2 inch pieces) | Broad Bean Paste with Chili 1 tbsp | Soy sauce (tamari) 1 tbsp | Coconut Oil 1 tbsp | Onion 1 sliced | Garlic 1 cloved (minced) | Ginger 1 tbsp (matchsticks) | Rice vinegar 1 tbsp","1) Heat oil in a wok and add onion. | 2) Stir fry until brown and caramelized, 7-10 minutes. Add garlic and ginger and fry for 30 seconds. | 3) Add cubed eggplant and spread in an even layer. | 4) Cook on medium for 5-10 minutes, until eggplant is seared on all sides and almost soft. | 5) Add beans and cook for 5 minutes longer, stirring frequently. | 6) Add soy sauce, bean paste, and rice vinegar. Stir to combine and cook for one minute longer. Serve hot with rice. | 7) Serving Size: Makes 3 servings"
Lugaw chicken : Chicken porridge,1,0,1,229,1.2,36.7,550.5,36.4,1.5,3,17.4,0.2,1.2,1.6,6.4,,1/2 cup shredded chicken cooked | 1 cup rice cooked | 1 carrot chopped | 1/4 of an onion diced | 2 cloves garlic minced | Broth:1 cup chicken broth | 1/2 cup water | Herbs de Provence | Cumin | Red pepper flakes,"1) Mix chicken broth ,water, and spices in a small pot. | 2) Add chicken, rice,carrot, and onion. | 3) Wait to add garlic until carrots are tender, but still have a bite and a raw taste (you know, how stewed carrots are sweet, but raw carrots have a distinct taste). | 4) Cook until carrots are soft and sweet."
Lugaw egg with banana : Egg porridge with banana,1,0,1,439,13.2,186,80.1,69,11.1,24.2,15.6,7.9,18,3.5,16.3,,1.5 cup Water | 0.5 cup Oats | 10 g Chia Seeds (optional) | 1 medium Banana | 1 large Egg whole | 0.5 tbsp Honey (optional),"1) Bring 1 cup of water to a boil. Lower to medium heat and add 1/2 cup of oats. Let simmer until the oats have sucked up all the water. If you want, you can add another 1/2 cup of water for extra soft and fluffy oats. | 2) When oats are cooked, add 10g of Chia Seeds (optional). Keep oats on the stove and whisk in one whole egg (just egg whites won't do!) and stir thoroughly until the glossiness has disappeared and you can spot thin white streaks. | 3) Mash banana and add to the mixture. Cook for another minute on low heat and transfer to bowl. Top with honey if required. "
Chicken noodle soup,1,0,1,152,3.7,51.2,76.1,13,2.5,1.1,17.4,0,7,2.7,7.1,,"Cold water | 1 bay leaf | 1 teaspoon black peppercorns | 1 tablespoon olive oil | 2 carrots, cut into ribbons with a vegetable peeler | 1 onion, diced fine | 2 stalks celery, diced fine | 4 ounces whole wheat pasta (cooked) | 1 tsp thyme, dried | 1/2 tsp oregano, dried | 1 tsp basil, dried (optional) | salt and pepper to taste","1) Remove the skin from the chicken. | 2) Place the whole chicken in a large stock pot or saucepan that will hold at least one gallon of cold water. | 3) Add the diced onion, celery, and carrots to the stock pot. Pour one gallon of cold water over the mixture and add the bay leaf and peppercorns. | 4) Bring the mixture to a boil and then immediately reduce to a simmer. | 5) Allow the mixture to simmer for 45 minutes. Place a strainer over another large saucepan and strain the hot chicken mixture. | 6) Strain the mixture a second time into the first pot using a coffee filter or cheesecloth. | 7) Reserve one quart of the stock for the freezer, and use the remaining for the soup. (Allow stock to cool to room temperature before freezing.) | 8) In one of the stock pots, heat the oil and add the second batch of vegetables cut into the small dice. Sweat vegetables over low moderate heat for 5 to 8 minutes. | 9) While the vegetables are sweating, pull all the meat off the bones of the chicken. | 10) Add the pasta, dried seasonings, and the pulled chicken meat to the pot simmer for an additional 10 minutes."
Chicken Sopas : Chicken soup ,1,0,1,186,4.7,45.8,103.6,16.6,1.4,4.3,18.8,0,11.3,11.7,6.6,,"200-250 grams chicken (chicken breast is best, but any part should be okay) | 3-4 cups water | 1 chicken stock cube (optional) | 1 small onion | sliced,1-2 cloves garlic | crushed/minced | 1 tsp cooking oil (vegetable or canola) | 1 cup small shell pasta | 1 carrot, cubed (as in, small cubes) | 1 stalk celery | sliced (leaves and bottom part removed) | 1/2 cup shredded cabbage | 1 egg | 1/2 cup milk | salt and pepper to taste |1 tsp fish sauce | aka patis (optional)","1) Boil the chicken in the water. You can already add the salt and pepper, if you like. | 2) Once the chicken is cooked, take it out of the water to shred or to slice. Save the water as stock for later. Set aside the shredded chicken.| 3) In a large saucepan, heat the oil. Add the garlic and saute until slightly brown, then add the onions.| 4) Add the shredded chicken.| 5) When the chicken is slightly brown, add the water (chicken stock). Add the chicken stock cube, if preferred. | 6) When the water boils, add the pasta. Make sure that there's enough water left for the pasta to cook. Just keep adding 1/2 cup of plain water (preferably hot), if/when needed. Make sure that you have enough liquid for a soup. | 7) As soon as the pasta is al dente (not quite cooked, but already softened), add the carrots and celery. Stir. | 8) After 2-3 minutes, add the shredded cabbage. Keep stirring. | 9) Add the egg. Make sure that you stir and break the egg - so you dont get one lump of egg in your soup.| 10) Once the egg is stirred in the soup, slowly add the milk and keep stirring. Remember not to add the milk all at once and you must stir, stir, stir. Otherwise, the milk might curdle | 11) When you have successfully added all the ingredients, check if you need to add salt and/or pepper. Some people also opt to use fish sauce."
Cabbage vegetable soup,1,1,0,165,1.8,0,273.5,36.6,12,4.1,8.3,0,0,12,14.8,,"1 28 oz can crushed tomatoes | 1 medium onion, diced | 3 stalks celery, diced | 3 medium carrots, diced | 1 head cabbage, shredded | 1 14.5 oz can green beans | 1 12 oz can sweet yellow corn | 1 15 oz can pinto beans","1) Place tomatoes, onion, celery, carrots, and cabbage in a pot, simmer over medium heat until tender, about 20 minutes.| 2) Add canned vegetables. Heat and serve. | 3) Serves 6, 1 1/2 cups per serving"
Nilagang saging : boiled banana,1,1,0,420,1.6,0,5,107.8,12.3,57.7,5.1,0,0,2,7,,12 pieces of banana,1) Using a knife cut individual bananas out of its stem and trim. | 2) Place in a large pot and pour enough water to cover at least 1 inch above the bananas. | 4) Bring to a boil and simmer for 15 to 20 minutes. | 5) Remove from pot drain and let cool down. Serve warm or cold.
Nilagang kamote : Boiled sweet potato,1,1,0,103,0.2,0,41,23.6,3.8,7.4,2.3,0,0,0,22,,5 sweet potato(kamote),"1) You can boil it whole or peel and cut them into cubes. | 2) To boil, start by filling a pot with water. Bring to the boil and throw in sweet potatoes to cook until tender. | 3) If cooking on high heat, the average cooking time is 12-15 minutes. Slow-cooking sweet potatoes might take 3-4 hours. | 4) Drain the water; Serve and enjoy."
"Egg sandwich(mashed boiled egg,salt,pepper,letuce)",1,1,0,122,5.4,186,349,10,0.6,1.5,7.8,0,0,4,11,,"2 slice Bread, White, Commercially Prepared (Includes Soft Bread Crumbs) |  1 large Egg, Whole Cooked, Hard-boiled | salt |  pepper | 1 leaf, large Lettuce, Iceberg (Includes Crisphead Types), Raw",1) Simply put the ingredients between the 2 slice of bread.
"Egg sandwich(scrambled egg, lettuce)",1,1,0,225,8.4,169,430,26.6,1.3,3.1,10,0,0,6,16,,"2 slice Bread, White, Commercially Prepared (Includes Soft Bread Crumbs) | 1 serving Egg, Whole Cooked, Scrambled | 2 Lettuce, Iceberg (Includes Crisphead Types) Raw",1) Simply put the ingredients between the 2 slice of bread.
Inabraw : Boiled vegetables with fried fish,0,1,0,172,1,17,636,32,11,14,12,0,37,86,2,,1Tilapia fried or grilled | 1 medium onion chopped | 1 medium tomato chopped | 1 thumb-size ginger sliced | 1 medium sweet potato peeled and cut into large cubes | 3 cups saluyot | 1 medium bitermelon cut into a ½ inch thick | 7 pcs okra | 3 medium eggplant cut into 2-3 inch long | 1 cup sitaw | 2 tbsp fish sauce or use bagoong isda | 2 cups water or more as required | salt and pepper to taste | cooking oil,"1) In a pan over medium heat, add the cooking oil and pan-fry the fish for 7 minutes on each side or until golden. Alternatively, you may grill the fish instead. | 2) Using a wide skillet, pour the water then add the onion, tomato, ginger and fish sauce or bagoong isda. Bring to boil then add the pumpkin, sweet potato, sitaw, bittermelon and eggplant. Cook until the vegetables are nearly tender. | 3)Add the saluyot and okra. Season with salt and pepper to taste. Put back the fried fish and serve with hot steamed rice."
Watercress and Chayote Squash Stew,1,1,0,49,3,0,37.8,5.4,1.8,0.2,1.6,0,0,5.9,7.3,,"1 chayote or other summer squash | 1 bunch watercress | 1c parsley (flat or curly) | 1 celery | 1 scallion | 1 clove garlic (minced) | 1TBSP olive oil | 1 can whole roasted tomatoes | 1 tea each smoked paprika, chili powder, ground cumin | 1/2 tea white pepper","1) Add oil to pot, wash and chop vegetables. Saute onion, garlic, celery, parsley and squash in the oil over medium heat until color begins to change. | 2) Stir in canned tomatoes (with juice) and spices. Bring to a simmer then place watercress on top and cover for a couple of minutes, allowing the cress to steam. | 3) Remove from heat and stir to mix in watercress. | 4) Variations: almost any variety of vegetables will work - try potatoes, white beans, carrots, spinach, cabbage, kale, garbanzos. | 5) Add broth for a thinner soup. | 6) May be served as a stew with rice or bread, atop fish, shrimp, sausage or pasta, or as a side dish"
Long Bean Chayote stirfry,1,1,0,117,3.7,0,20.2,20.1,4.5,1.5,4.1,0,20.1,4.6,7.3,,1 chayote peeled and chopped | 2 to 2.5 cups chopped long beans | 1 onion chopped | 1 cup chopped carrot | 4 T flaxseed | 1 cup cooked white rice | oil,1) Stir fry all vegetables in large frying pan with olive oil and teriyaki seasoning
Chayote stew,1,1,0,144,4.6,18.4,271.6,16.4,3.9,4.8,9.9,19.9,126,4.4,9.6,,"1 tbsp olive oil | 1 cup chopped onion | 5 oz pork loin, lean, diced |1 chayote, peeled and diced | 1/2 cup cooked chickpeas | 1 tsp chile powder,1 - 15oz can Muir Glen Organic Fire Roasted Diced Tomatoes | 2 cup Pacific organic Vegetable Broth Low Sodium | 2 cups sliced or diced red/yellow sweet peppers | 1 cup chopped ripe tomatoes | 1 tsp Oregano","1) Heat up oil in soup pot. Add onion, garlic, peppers, and pork. | 2) Saute till begins to brown - add chayote. Saute for 5 - 10 minutes and then add the rest of the ingredients. | 3) Add 1 cup of water (or more, depending on how long you let it simmer).  | 4) Let simmer for at least 30 minutes."
Scrambled eggs with mixed vegetable saute,1,1,1,204,11.7,372,177.4,11.4,2.2,5.4,15.7,92,0,8.9,14,,"2 large Egg fresh whole | 0.25 cup chopped Onions | 0.5 cup Bell peppers (Green, Red, Yellow, Orange) | 0.25 cup or pieces or slices Mushrooms, fresh | 1 cup Baby Spinach - Fresh Express (bagged) | 1 serving Garlic - minced (1 tsp)","1) Saute onions, bell peppers, garlic. mushrooms and spinach. | 2) Beat 2 Large eggs in bowl then pour over vegetables. | 3) Scrambled until eggs are done. Season to taste."
Eggplant and vegetable saute,1,1,0,203,1.1,0,114.6,43.2,11.1,0,9.6,51,0,8.2,15.5,,1 large eggplant (peeled and cubed) | 2 meduim onions (chopped) | 1 yellow bell pepper (chopped) | 1 red bell pepper (chopped) | 4 tsp minced roasted garlic | 3/4 tsp dried rosemary leaves | 1/2 tsp dried savory leaves | 1/4 - 1/2 tsp dried thyme leaves | 1 can cannellini beans (or great northern beans) rinsed and drained | salt/pepper to taste | 8 oz. whole wheat spaghetti (cooked),"1) Lightly spray a large, non-stick saucepan with cooking oil over medium heat until hot | 2) Cook eggplant, onions, bell peppers, and garlic over medium heat (covered 5 min) | 3) Then uncovered until vegetables are tender (5-8 min) | 4) Stir in beans and herbs, cook until very hot | 5) Season to taste with salt and pepper | 6) Serve hot over spaghetti,(optional) | 7) For a spicy versions of this dish, add 1 tsp of crushed red pepper when initially cooking vegetables"
Chicken and vegetable saute,1,1,1,109,1,37,154.5,8.3,2.3,3.6,16.4,22.5,0,3.3,5.7,,sliced 1 yellow squash cut into cubes | 1 med sweet onion cut into slices | 1 (16 oz) can diced tomatoe flavored | basil and olive oil | 1 zucchini cut into cubes | 1 small eggplant cut into cubes (optional) | 1-2 tsp Mrs Dash salt-free,"1) Spray skillet with non stick, non fat spray .( I use Mazola.) If I need more moisture I add organic chicken broth. | 2) Add sliced onion, chicken tenders and sliced red peppers. | 3) Cover and saute for 5-10 minutes turning chicken to brown on all sides. | 4) Add yellow squash, zucchini , eggplant and seasoning to taste. Cover and saute another 5 minutes until chicken is cooked through and all vegs are cooked but not mushy."
Bok Choy(chinese cabbage) and carrot stir fry,1,1,0,32,1.2,0,83.4,4.9,1.2,1.7,1.6,0,22.9,2,1.7,,"Large bunch of bok choy, chopped coarsely (about 2 cups) | 1/2 cup chopped green onion | 1 cup thinly sliced carrot | 1 tsp. sesame oil | 1/2 tsp. soy sauce | black pepper to taste",1) Heat oil in a wok or large frying pan on high. | 2) Add carrots and saute about a minute. Add bok choy and onion. | 3) Saute about four minutes or until bok choy is wilted (but stems are still kind of crunchy). | 4) Add pepper and stir in the soy sauce right at the end.
Cabbage and carrot fried rice,1,1,1,195,6.6,93.5,275.4,28.1,3.2,0.9,6.3,0,16.6,4.4,6,,2 cups brown rice cooked | 2 eggs scrambled | 1/2 onion chopped | 2 cloves garlic | 1 carrot diced | 1 cup cabbage chopped | 1 tbsp. Olive oil | 1 tbsp. soy sauce,"1) Saute onion, garlic and carrots in olive oil until transparent. | 2) Add cabbage and continue to saute until soft, yet crisp. | 3) Add rice and blend well. | 4) Add soy sauce and continue stirring. | 5) Fold in the scrambled egg."
Spicy Garlic Baby Bok Choy,1,1,0,62.6,4.7,0,598.7,3.7,0.2,0.3,2.3,0,17.8,0.6,0.4,,1.5 lb baby bok choy (chopped) | 1tpsp e.v.olive oil | 3 cloves garlic minced | 1tsp garlic powder | 3tbsp kikkoman lite soy sauce | 1 tsp crushed red pepper | 1/5 cup water (or chicken/veggie stock),"1) In a large stockpot (deep like the ones you boil spaghetti in) add the olive oil and heat to medium on the stove. | 2) Add garlic and lightly brown. When browned throw in all of the bok choy and stir around a couple of times. | 3) Cover and let cook for about 3 minutes. Open and add soy sauce, garlic powder, and red pepper.. stir continuously for about 2 minutes and add water to make a lite sauce on the bottom of the pan. | 4) Stir for 2-3 more minutes or until all bok choy is tender.  | 5) Serve in a bowl, scoop some sauce out of the pot and pour over for extra deliciousness!"
Bok choy(chinese cabbage) stir fry side dish,1,1,0,107,7.1,0,522.2,9.6,1.2,0.2,4.4,0,0,1.8,1.8,,Bok Choy | raw-shreaded 3 cup | Canola Oil 1 tbsp | Garlic 2 clove | Onions raw 1 cup sliced | Soy Sauce 1 tbsp,"1) Heat oil in wok | 2) Add sliced onions and garlic | 3) Saute until soft,Add bok choy and stir with 1tbs soy sauce"
Stir fried bean sprouts,1,1,0,212,0.8,0,4,38.7,15.4,4,14.2,1,3.4,5.5,15.7,,1 cup (8 ouces) mung bean sprouts | 1 tablespoon soy sauce | teaspoon sugar{ if you like} | salt to taste | 1 tablespoon vegetable oil for stir-frying | few drops of Sesame oil,"1) Wash and drain the bean sprouts, trimming the ends if desired. | 2) Add oil to a wok or heavy skillet. When oil is ready, add the bean sprouts and stir-fry briefly. | 3) Add the soy sauce, sugar and salt. | 4) Stir-fry another few seconds and add the sesame oil. Serve hot."
Chicken & Cabbage Spring Rolls,1,1,1,175,16.6,11.4,32.1,8,1.5,1,5.3,52,16.6,2.4,2.1,,Spring Roll Skins 18 skins | Chicken Breast no skin | Cabbage fresh 1.5 cup chopped | Carrots raw 1 cup chopped | Onions raw 1 cup chopped,"1) Saute or steam vegetables and chicken. | 2) Season as desired. | 3) Moisten spring roll wrappers, fill & roll."
Black Bean and Cabbage,1,1,0,300,5.3,0,565,54.8,11.5,3.9,10.6,0,0,8,23,,"2 tablespoons olive oil | 1 large onion, chopped | 1 leek, chopped | 1 tablespoon chopped fresh thyme | 1 tablespoon paprika | 3 Cloves of garlic | 1/4 lbs. potatoes, coarsely chopped | 14 oz. can black beans | 3 1/2 cups low-sodium vegetable stock | 6 oz. cabbage or scallions shredded","1) Heat oil in a large saucepan.  | 2) Add onion and leek and saute for 3 minutes. | 3) Add garlic and paprika and continue to saute for 2 minutes. | 4) Add thyme, potatoes, beans, vegetable stock and bring to a boil. Reduce heat, cover and simmer for 10 minutes or until potatoes are cooked through. | 5) Add cabbage or scallions and season to taste with salt and pepper. | 6) Simmer for 5 minutes the serve"
Sweet and sour chicken and cabbage soup,1,1,1,333,3.6,73.1,106.7,62.9,3.6,54.5,29,4.6,0,12.8,16.1,,1 medium cabbage | 3 skinless chicken breasts | 1 cup packed brown sugar | 2 cups apple cider vinegar | 1 T ground allspice | 6 cups water,"1) Parboil chicken let cool until easy to handle. | 2) Meanwhile, in another pot add 6 cups water, and rest of the ingredients. Bring to a boil. | 3) Cut up chicken into bite-size pieces and add to boiling cabbage. (Pork or beef may be substituted. Cut pork or beef into bite-size pieces and pan fry with cooking spray.),Boil cabbage 15 minutes. | 4) Reduce heat to simmer for 1 hour or until cabbage is tender. | 5) If not sweet enough I add Splenda 1 teaspoon at a time."
Cabbage and Zucchini,1,1,0,53,0.4,0,932,12.1,4,2.3,2.6,18.4,0,7.6,6.2,,1 medium head cabbage chopped | 3 medium zucchini (about 3 cups) sliced | 3 tbsp onion powder | 1 tbsp garlic powder | 1 tbsp salt | 1 tsp ground black pepper,"1) Heat the skillet over a medium flame. | 2) Add about half the cabbage and zucchini and season with half of the seasonings, stir. | 3) Add the remaining cabbage, zucchini and seasonings, stirring really well.| 4) Cover and simmer on a low flame until the cabbage is soft (about 30 - 60 minutes).| 5) The vegetables need no oil or water as they will naturally release a lot of moisture. Also, the cabbage will reduce by half as it softens. You can omit the garlic and onion powder, salt and pepper and season any way you like."
Avocado Tomato and corn salad,1,1,0,63,3.7,0,193.6,8,2.1,0.9,1.4,5.9,11.2,0.5,2.2,,"1 avocado, diced | 2 cups of corn | 2 cups of cherry tomatoes, quartered | 1/4 cup red onion, diced | 1 T. olive oil | Juice of half a lemon | 1 T. salt | 1 T. pepper | 1 T. chili pepper or cayenne pepper",1) Prepare and combine all vegetables in a salad bowl. | 2) In a small bowl combine spices and lemon juice. Whisk in olive oil. | 3) Pour over and toss into salad. | 4) Chill or serve immediately..
Sesame green beans,1,1,0,37,2,4,820.9,4.5,2,0.1,1.4,8.3,15,3.1,4.4,,"1 lb. green beans, trimmed | 1 tsp. salt | 1 tbsp. soy sauce | 3 splashes of ginger juice OR 1/2 tsp. of freshly grated ginger root | 1/5 tbsp. butter, cubed | 1 1/2 tsp. toasted sesame seeds | 1 tbsp. rice wine vinegar","1) Steam green beans for about 10 mins | 2) When the beans are cooked through but still crisp, place in a serving bowl | 3) Toss all other ingredients and serve use soy sauce 1 tbs at a time to taste if it fits your taste"
"Potato, Carrot, and Leek Soup",1,1,0,217,6.8,15.3,1084.7,36.3,4.5,7.2,4.5,0,40.4,7.8,12.9,,"4 large leeks, cut lengthwise, separate, clean | 2 Tbsp butter | 4 cups chicken broth | 1 lbs potatoes, peeled, diced into 1/2 inch pieces | 1 lbs carrots, peeled, diced into 1/2 inch pieces | Salt & Pepper","1) Cook leeks in butter with salt and pepper in a medium sized sauce pan. | 2) Cover pan, cook on low heat for 10 minutes. Check often. Do not brown leeks! Browning will give leeks a burnt taste. | 3) Add broth, carrots, and potatoes. Cook for 20 minutes. | 4) Scoop about half of the soup mixture into a blender, puree and return to pan. | 5) Add salt & pepper to taste."
Roasted cauliflower,1,1,0,80,5,0,200.4,8.6,4,0.2,3.1,0.6,0,3.6,4.6,,1 1/2 cups cauliflower florets | 1 tsp extra-virgin olive oil | 1/4 tsp garlic powder | 1/4 tsp pepper | Salt to taste,"1) Preheat oven to 425 degrees. | 2) In a medium bowl, combine the cauliflower and spices. Toss to mix. | 3) Drizzle on the oil and toss again.| 4) Transfer the mixture to a small nonstick baking dish. Bake for 15-17 minutes, tossing as needed, or until lightly browned and crisp tender. | 5) Serve immediately."
Faux Fried Rice - Cauliflower,1,1,1,155,9.8,212.5,869.6,8.7,3,0,9.5,6.8,0,5.8,7.3,,"1/2 head of raw cauliflower, grated | 3 green onions, chopped | 4 cloves garlic, minced | 2-3 tbsp. low-sodium soy sauce | 1 tsp. garlic & salt | 3 eggs beaten | oil | Pork, chicken or shrimp, cooked (optional)","1) In a wok or large skillet, heat eough oil to cover bottome of pan. Fry minced garlic and white part of onions for approximately 1 minute. | 2) Add cauliflower and fry for approximately 5 minutes stirring constantly. | 3) Add soy sauce, garlic salt, green onion tops amd meat (optional) and stir until mixed. | 4) Push mixture to side of pan. Add more oil if necessary, and scramble eggs in empty side of pan until done but still moist. | 5) Stir eggs into ""rice"" and remove from heat."
Kinilaw na tanique : Filipino ceviche fish,1,1,0,207,13,0,376,18.4,6,12,9,0,0,0,0,,"2 lbs. Tanigue Wahoo fish, fillet and cut into cubes | 2 thumbs fresh ginger minced | 8 pieces hot chili Thai chili or siling labuyo, chopped | 15 to 20 pieces calamansi | 1 medium red onion chopped into small pieces | ¼ teaspoon ground black pepper | ½ teaspoon sugar | Salt to taste","1) Squeeze the juice out of the calamansi over a large bowl. Use a sieve to filter the seeds. Discard the seeds. | 2) In the bowl with calamansi juice, add sugar, ½ teaspoon salt, and ground black pepper. Stir until the sugar and salt are diluted. | 3) Add the ginger, chili, and onion. Stir for a few seconds until all ingredients are well blended. | 4) Arranged the raw fish cubes in a large bowl. Pour the calamansi mixture. Toss until the fish cubes are coated. Let is stay for 10 minutes. | 5) Toss one more time and taste. Add more salt if needed. You can also add more calamansi juice if needed. Toss to blend all the ingredients. Securely cover the bowl and place it inside the refrigerator. Let it chill for at least 3 hours. | 6) Serve. Share and enjoy!"
