Pinakbet Ilocano : Ilocano Style Sauteed Vegetable,1,1,1,250,16,0,20,18,6,0,24,22,49,14,36,,"4 pieces round eggplant cut in half|2 pieces small bitter melon ampalaya, quartered|½ bundle string beans cut into 2 inch length|1 piece sweet potato kamote, quartered|8 pieces okra|1 piece tomato cubed|1 piece onion cubed|1½ cup water|1 lb bagnet|1/4 cup Anchovy sauce bagoong isda","1)In a large pan, place water let boil|2)Put in the anchovy sauce and wait for the mixture to boil once more|3)Add-in the vegetables starting with the sweet potato then put-in the okra, bitter melon, eggplant, string beans, tomato, and onion and simmer for 15 minutes|4)Add the bagnet or lechon kawali (cooking procedure available in the recipe section) and simmer for 5 minutes|5)Serve hot. Share and Enjoy!"
Lumpiang Sariwa : Fresh Spring Rolls,1,1,0,99,4.4,17,108,11.6,0.4,0.3,3.1,0,0,0,0,,"2 cups sweet potato cubed|2 tbsp fish sauce patis|1 lb cabbage shredded|1 ½ cup carrots julienned|½ cup water|½ cup peanuts crushed|6 pieces Lettuce leaves|½ lb pork thinly sliced|1 pack extra firm tofu sliced in strips|1 cup shrimp shelled and deveined|2 cups string beans baguio beans, chopped|1 medium sized onions chopped|½ cup cilantro chopped|3 tbsp garlic minced|1 pork cube|>>Wrapper ingredients<<|1 cup all-purpose flour|2 pieces raw eggs|2 tbsp cooking oil|½ tsp salt|1½ cups milk|>>Sauce Ingredients<<|1 tbsp soy sauce|½ cup brown sugar|2 cups water|½ pork cube|1 tbsp garlic minced|2 tbsp corn starch diluted in 4 tbsp water","1)Cook the filling by heating a pan. Pour-in the cooking oil then sauté the garlic and onions. Add the pork and cook until color turns light brown. Put-in the pork cube and add ½ cup water then simmer until pork is tender. Add the shrimps and sweet potatoes and cook for 5 minutes or until potatoes are soft. Add the tofu and cook for a few minutes. Put-in the cilantro, carrots, and string beans then mix with the other ingredients. Add the cabbage and let cook for 5 minutes. Add the fish sauce and mix. Set aside|2)Make the wrapper by cracking the eggs in a mixing bowl. Beat. Add the milk while beating. Put in the salt and all-purpose flour then mix thoroughly. Add the vegetable oil and mix well. Turn the stove on to medium heat and put the non-stick pan in place. Spray the pan with oil or grease with butter. Pour-in the wrapper mixture (about half a cup) and tilt the pan to distribute the liquid evenly. Cook until the top part of the mixture is dry (about 2 minutes). Using a spatula, remove the cooked mixture and place in a flat plate. Set aside|3)Make the sauce by pouring water in a sauce pan. Bring to a boil. Add the brown sugar and pork cubes. Put some salt and soy sauce then mix well. Dilute the cornstarch in water and pour in the saucepan. Cook until the sauce becomes thick. Set aside.|4)Wrap the filling. Place the wrapper in a plate then place a lettuce leaf in the middle top part of the wrapper. Spoon the filling and place in the middle of the wrapper (over the lettuce leaf). Close the wrapper by folding the lower part first then roll the sides until the filling is sealed.|5)Pour the sauce over the Lumpiang Sariwa and garnish with crushed peanuts and minced garlic.|6)Serve. Share and Enjoy!"
Chop Suey,0,1,1,167,7.8,35.9,556,9.1,2.5,3.8,15.7,34.8,78,6.5,9.6,,7 pieces shrimp cleaned and deveined|3 ounces pork sliced|3 ounces boneless chicken breast sliced|1 ½ cup cauliflower florets|1 piece carrot sliced crosswise into thin pieces|15 pieces snow peas|8 pieces baby corn|1 piece red bell pepper sliced into squares|1 piece green bell pepper sliced into squares|1 ½ cups cabbage chopped|12 pieces quail eggs boiled|1 piece yellow onion sliced|4 cloves garlic crushed|¼ cup soy sauce|1 ½ tablespoons oyster sauce|¾ cup water|1 tablespoon cornstarch diluted in ½ cup water|¼ teaspoon ground black pepper|3 tablespoons cooking oil,"1)Heat oil in a wok or pan.|2)Pan fry the shrimp for 1 minute per side. Remove from the wok. Set aside.|3)Saute onion. Add garlic and continue to saute until the onion becomes soft.|4)Add pork and chicken. Stir fry until light brown.|5)Add soy sauce and oyster sauce. Stir.|6)Pour water. Let boil. Cover and cook in medium heat for 15 minutes.|7)Add cauliflower, carrots, bell peppers, snow peas, and young corn. Stir|.8)Add cabbage. Toss. Cover and cook for 5 to 7 minutes.|9)Put the pan-fried shrimp into the pot and add ground black pepper.|10)Add the boiled quail eggs and cornstarch diluted in water. Toss.|11)Transfer to a serving plate. Serve.|12)Share and enjoy!"
Ginataang kalabasa at malunggay,1,1,1,418,20.4,0,186,46.4,20.9,14.5,20,0,0,15,33,,"3 tablespoons cooking oil | 3 cloves garlic, finely chopped | 1 large red onion, finely chopped | 3 cups kalabasa, cubed, sliced thinly | 2 cups coconut milk | 1 piece green chili (siling pangsigang), Optional | 2 cups coconut cream | 1 cup fresh malunggay leaves | fish sauce (patis), to taste | ground black pepper, to taste","1) Heat oil in a cooking pot. Saute the garlic and onion until the onion becomes soft. | 2) Add kalabasa and sauté for 2 to 3 minutes. Pour in the coconut milk. Stir and bring to a boil. | 3) Cook for 10 minutes, and add the green chili and the coconut cream. | 4) Cover and bring to a simmer slowly until the kalabasa is tender. (Do not boil the coconut cream.)  | 5) Add malunggay leaves. Cook for 2 to 3 minutes. Add fish sauce and black pepper to taste. | 6) Transfer to a serving bowl. Serve hot."
Ginisang Monggo : Sauteed Mung Beans,0,1,1,140,2.5,0,50,27,3,12,2,0,0,6,10,,1 1/2 cups Mung beans|1 tbsp garlic|½ lb pork thinly sliced|2 cups spinach (or alugbati)|1 piece tomato chopped|1 piece onion chopped|8 pieces shrimp optional|2 tablespoons fish sauce|24 ounces water for boiling|1 piece Knorr beef cube for flavoring|1/2 cup crushed pork rind chicharon|1/4 teaspoon ground black pepper,"1)In a pan, put-in the water and bring to a boil|2)Put-in the Mung beans and simmer until becomes soft (about 35 to 50 minutes)|3)On a separate pan, sauté the garlic,onion, and tomato|4)Add the pork. Cook for 5 mins|5)Put-in the beef cube and fish sauce. Simmer for 10 mins or until the meat is tender. Note: If necessary, you may add water to help make the meat tender but make sure to add more time to simmer|6)Add the shrimp. Stir and then cook for 2 minutes.|7)Pour the cooked Mung beans. Stir and then simmer for 10 minutes|8)Add the spinach and pork rinds (chicharon)|9)Sprinkle the ground black pepper|10)Serve hot. Share and Enjoy!"
Ensaladang Talong : Filipino Styled Roasted Eggplant,0,0,1,120,6,50,120,16,1,9,2,0,0,2,2,,2 pieces Chinese eggplant|2 pieces tomato|1 piece onion|¾ cup vinegar white|½ teaspoon salt|¼ teaspoon ground black pepper|2 tablespoons shrimp paste bagoong,"1)Grill the eggplant (or cook directly on stove top)|2)Peel the skin, cut the stem, and mash lightly using a fork.|3)Cube the tomatoes and onion.|4)Combine the chopped tomatoes, onion, mashed eggplant, salt, ground black pepper, and vinegar then toss to mix the ingredients.|5)Top with shrimp paste.|6)Serve. Share and Enjoy"
Tofu Sisig,0,1,1,220,16,5,0,19,1,16,2,0,0,5,2,,14 oz. extra firm tofu sliced into small cubes|5 pieces Thai chili chopped|2 long green pepper chopped|1 medium yellow onion chopped|10 tablespoons vegetable broth|1 teaspoon cornstarch|1/2 teaspoon onion powder|1 tablespoon soy sauce|1 1/2 cups cooking oil|Salt and ground black pepper to taste,"1)Heat oil in a cooking pot.|2)Once the oil gets hot, deep-fry the cubed tofu until it turns crispy. Remove from the pot using a kitchen strainer. Put in a metal colander or into a plate lined with paper towel. Set aside.|3)Combine vegetable broth, soy sauce, onion powder, and cornstarch in a bowl. Stir until all the ingredients are well blended. Set aside.|4)Scoop 3 tablespoons of oil from the pot where the tofu were fried. Pour it in a clean pan. Heat the pan on a stove top.|5)Saute onion, long green peppers, and chili.|6)Add the crispy fried tofu. Stir-fry for 1 minute.|7)Pour the bowl with broth mixture into the pan. Toss the ingredients until coated with the mixture.|8)Add salt and pepper to taste.|9)Transfer to a serving plate. Serve with a dipping sauce composed of say sauce, calamansi, and crushed chili peppers.|10)Share and enjoy!"
Paksing Demonyo : Filipino Vegetable Vinegar Stew,0,0,1,98,1,0,168,20,2,16,1,81,44,40,1,,"1–2 bitter melon/ampalaya, prepared and sliced|2–3 pcs Asian eggplant, sliced|1 bunch string beans, sliced into two inch sections|1 tomato, sliced|1 large red onion, chopped|4 cloves garlic, minced|1 thumb sized ginger, minced|2 pcs scotch bonnet chillies or birds eye chillies, finely chopped|2 tbsp brown sugar|3/4 cup cane vinegar|3/4 cup water|fish sauce|freshly ground black pepper","1)Coat the ampalaya slices generously with salt. Set aside for 15 minutes. Rinse ampalaya with cold running water and get rid of all the salt. Drain well.|2)In a wok add oil then sauté garlic, onion, ginger and chillies.|3)Combine vinegar, water and= sugar, bring to a boil then add the vegetables.|4)Simmer for 12-15 minutes or until vegetables are cooked.|5)Season with fish sauce and freshly ground black pepper then serve."
Menudong Nagcarlan,0,1,1,167,2,0,839,21,5,4,8,30,17,70,2,,"600g beef tripe, cut in small cubes (cleaned and pre-cooked)|2 pcs small chayote, cut into small cubes|150 g green beans, cut into small sections|1 large potato, cut in small cubes|1 large carrot, cut into small cubes|1/4 cup cream|2 heaping tbsp peanut butter|1 medium sized red onion, diced|2 cups chicken stock|6 cloves garlic, minced|2 pcs bay leaves|freshly ground black pepper|fish sauce|oil","1)On at pot sauté garlic and onion in oil.|2)Add tripe and brown on all sides.|3)Add chicken stock and bay leaves. Bring to a boil and simmer for 25 minutes in low heat|4)Add potatoes, carrots, chayote and peanut butter. Simmer for 15 minutes in medium heat|5)Add green beans simmer for 5 more minutes in medium heat.|6)Mix in the cream, flavour with fish sauce and season with freshly ground black pepper."
Dinoydoy : Sauteed Bitter Melon & Nearly Pureed Squas,0,0,1,220,2,20,120,2,2.5,5,30,20,10,14,8,,"1 large bitter melon, sliced|half small butternut squash|200 g pork belly, thinly sliced|2 cups chicken stock|1 onion, finely chopped|6 cloves garlic, chopped|1 size tomato, chopped|fish sauce|freshly ground black pepper|cooking oil",1)In a wok sauté garlic and onions.|2)Add pork and brown on all sides and crispy.|3)Add tomatoes and cook for 2 minutes.|4)Add chicken stock and squash and cook for 15-20 minutes or until it starts to disintegrate.|5)Add bitter melon then cook for 5 more minutes or until bitter melon is cooked.|6)Season with fish sauce and freshly ground black pepper.
Sipo Egg : Filipino Quaill Egg & Shrimp,0,1,1,96,1.4,375,31.5,0,0,0,5,0,0,0,1,,1 lb. shrimp head and shell removed and deveiened|20 pieces quail eggs boiled and peeled|1 piece onion minced|1 teaspoon minced garlic|1/4 cup butter|1 tablespoon cooking oil|1 1/2 cups green peas|1 piece carrot cubed|3/4 cup water|4 ounces ham minced (optional)|1 can cream of mushroom 10 oz.|3/4 cup singkamas cubed|1/2 cup heavy whipping cream|Salt and pepper to taste,"1)Melt the butter in a cooking pan.|2)Add the cooking oil.|3)Once the mixture becomes hot, saute the shrimp for a minute per side.|4)Remove the shrimp and set aside.|5)Meanwhile, saute the onion and garlic.|6)Put-in the carrot and green peas. Add the ham (this is an optional ingredient).Cook for 3 minutes.|7)Pour-in the water (I used water with shrimp juice in the video).Let it boil. Cook for 1 minute.|8)Add the quail eggs and shrimp.Stir.|9)Pour-in the cream of mushroom and table cream. Stir once more until the ingredients are well distributed.|10)Add water chestnuts, salt and pepper.|11)Transfer to a serving bowl.|12)Serve. Share and enjoy!"
Lumpiang Hubad : Spring Rolls Withouth Wrapper,0,1,1,135,3.4,40.9,449.2,17,3.3,6.7,10.4,108.4,13.4,4.2,6.3,,1 lb. pork shoulder sliced into small pieces|1 piece Knorr Pork Cube|2 cups cabbage shredded|1 piece singkamas sliced into strips|1 cup Baguio beans sliced into thin pieces|1 piece kamote sliced into strips|1 piece carrot julienne|1/4 cup parsley chopped|1 piece onion sliced|6 cloves garlic crushed|Patis and ground black pepper to taste|3 tablespoons cooking oil|<<Sauce>>|1 1/2 tablespoons soy sauce|½ cup brown sugar|4 cloves garlic crushed|1 1/2 cups water|2 tablespoons cornstarch|1/4 cup chopped peanuts,"1)Heat oil in a cooking pot. Saute onion and garlic until onion becomes soft.|2)Add pork. Cook until brown.|3)Pour 1 ½ up to 2 cups of water. Let boil.|4)Add Knorr Pork Cube. Stir. Cover the pot and cook between low to medium heat until the liquid evaporates and the pork tenderizes.|5)Add parsley, carrot, kamote, and ½ cup water. Cover the cooking pot. Cook for 2 minutes.|6)Put the long green beans and cabbage into the pot. Toss. Cover the pot and cook for 5 minutes.|7)Season with fish sauce and ground black pepper.|8)Add singkamas. Toss. Arrange on a serving plate. Set aside.|9)Prepare the sauce by combining cornstarch with 3 tablespoons water. Stir until the cornstarch dilutes. Set aside.|10)Pour 1 ½ cups water into a saucepan. Let boil.|11)Add soy sauce and garlic. Cook for 2 minutes.|12)Add dark brown sugar. Stir.|13)Pour the cornstarch diluted in water. Stir. Continue to cook while stirring until the desired consistency is achieved.|14)Pour the sauce over lumpiang hubad. Top with crushed peanuts."
Ginisang Bistuelas : Sauted Green Beans with Carrots,0,1,1,167,8,0,32,25,2,18,2,0,0,0,0,,"10-12 carrots|½ lb fresh green beans|1 Tbsp olive oil|2 tsp garlic powder|2 tsp onion powder|Fresh pepper, to taste","1)First, bring a large pot of water to a boil, then add 10-12 carrots and cook for about 4 minutes.|2)Add in ½ lb of green beans and boil for an additional 3-4 minutes. |3)Remove the pot from heat and drain, then put the carrots and green beans in an ice bath to stop the cooking process and preserve their color and texture. |4)Next, heat a pan over medium heat with 1 tablespoon olive oil and toss in the carrots and green beans. Sprinkle with 2 teaspoon garlic powder, 2 teaspoon onion power, and fresh black pepper to taste.|5)Toss well and allow to sauté for 2 minutes.|6)Serve immediately and enjoy!"
Ginisang Togue : Sauteed Mung Bean Sprout,1,1,1,191,11,0,0,23,16,2.5,3,0,0,0,0,,12 ounces mung bean sprout|8 ounces tofu extra firm|1 piece carrot julienne|12 pieces shrimp head and scales removed|1 piece tomato cubed|1 piece onion chopped|4 cloves garlic minced|1 piece red bell pepper cut into strips|1 piece green bell pepper cut into strips|2 tablespoons oyster sauce|Ground black pepper to taste|1 1/4 cups cooking oil,"1)Fry the tofu until color turns golden brown then set aside. (slice the tofu into cubes)|2)Sauté the garlic, onion, and tomato.|3)Once the onion and tomato softens, add the shrimp. Saute for 1 minute.|4)Add the tofu. Cook for 30 seconds.|5)Add the mung bean sprouts and carrot. Saute for 1 minute.|6)Add the bell peppers. Cook for another minute.|7)Season with oyster sauce and ground black pepper.|8)Serve hot with rice. Share and enjoy!"
Bas Uy : Pork and Liver with Lemongrass,1,1,0,320,12,120,450,21,3,8,30,21,40,10,15,,1 lb. pork shoulder sliced|1/2 lb. pig liver sliced|2 pieces chayote sliced|4 stalks green onion or onion leek; cut in 2 inch length|1 thumb ginger julienne|1 medium yellow onion minced|3 cloves garlic minced|2 stalks lemongrass tied|6 cups beef or pork broth|3 tablespoons cooking oil|Salt and pepper to taste,"1)Heat the cooking oil in a cooking pot.|2)Once the oil becomes hot, sauté onion and ginger until the onion becomes soft.|3)Add the sliced liver. Continue to sauté for 2 minutes. This will remove the gamy taste and aroma. Remove the liver and temporarily place in a clean plate.|4)Put-in the garlic. Saute until color turns light brown.|5)Add-in the pork. Cook for 3 to 5 minutes.|6)Pour-in the beef broth. Let boil.|7)Put-in the lemongrass. Cover and simmer for 30 to 45 minutes.|8)Remove the lemongrass. Put-in the chayote and cooked liver. Continue to cook in medium heat for 3 to 5 minutes. Add water, if needed.|9)Add-in the green onion or onion leeks. Cook for 2 minutes.|10)Add salt and pepper to taste. You can also use fish sauce if you prefer.|11)Serve hot with rice.|12)Share and enjoy!"
"Poqui Poqui : Roasted Eggplant, Tomato, and Eggs",1,1,0,317,17,0,0,0,0,0,11,0,0,0,0,,"2 large eggplants|2 tablespoons oil|1 small onion, peeled and sliced thinly|2 cloves garlic|2 large Roma tomatoes, chopped|4 eggs, beaten|salt and pepper to taste","1)Over hot coals or gas stove, grill eggplants until skins are charred. Remove from heat and under running water, peel skin and rinse well. Coarsely chop flesh.|2)In a skillet over medium heat, heat oil. Add onions and garlic and cook until softened.|3)Add tomatoes and continue to cook, mashing with the back of the spoon, until softened.| 4)Add eggplant. Season with salt and pepper to taste.|5)Add beaten eggs, stirring to combine, and continue to cook until eggs are just set. Serve hot."
Champinones al Ajillo : Grilled Mushrooms,1,1,0,280,20.7,0,12.3,9.2,1.7,2.9,4.1,0,0,0,0,,"50g butter|20 pcs small button mushrooms|4 cloves garlic, minced|1 tbsp lemon juice|freshly ground black pepper|salt","1)Melt butter in a large frying pan over a medium heat.|2)Add garlic and cook until golden brown.|3)Put the heat on high then, add the mushrooms and stir fry for around 2 minutes.|4)Add the lemon juice then season with salt and freshly ground black pepper."
Apan Apan : Adobong Kangkong With Fried Pork,0,0,1,33.6,0.3,0,649,4.6,1.7,0,3.2,0,0,126.9,2.9,,Leaves from 1 large bunch of kangkong water spinach|¼ lb. Tulapho crispy fried pork|6 cloves garlic crushed|1 medium onion diced|3 tablespoons bagoong alamang or guinamos|5 tablespoons coconut vinegar|2 tablespoons soy sauce|Salt and pepper to taste|3 tablespoons cooking oil,1)Heat the oil in a large wok or pan.|2)Add the garlic and cook until brown.|3)Stir-in the onion; continue to cook until soft.|4)Add the crispy fried pork. Saute for a minutes.|5)Stir-in the bagoong|6)Pour-in vinegar and let boil. Stir.|7)Add the soy sauce. Stir.|8)Add the kangkong leaves. Toss.|9)Sprinkle salt and pepper. Toss and make sure that all ingredients are well blended. Cook for 2 to 3 minutes.|10)Transfer to a serving bowl. Serve.|11)Share and enjoy!
Nilagang Okra at Inihaw na Talong : Stewed Okra and Grilled Eggplant,0,1,1,100,2.5,50,200,28,20,0,15,10,10,5,5,,1 dozen okra|2 Asian eggplants|3 tbsp bagoong monamon|juice from half lemon,"1)Put water in a small pot, bring to a boil then add the okra. Cook until okra is tender, remove from pot then place in a plate.|2)Light up a charcoal grill and cook Asian eggplants until charred and tender, remove from grill then place in plate.|3)Combine bagoong monamon and lemon juice in a saucer then serve with vegetables."
Lawot Lawot : Mixed Vegetables In A Viscous Soup,1,1,0,456.9,10.8,0,4.7,64.6,5.1,0,24.6,5,2,23,4.7,,"150 g pork belly, cubed|300 g okra, sliced into 2-inch pieces|¼ squash or buttercup, sliced roughly 1 inch|1 large bunch spinach (large leaf type) or alugbati|2 bunches kangkong, tender stalks and leaves only|3 medium tomatoes, diced|200 ml coconut cream|400 ml coconut milk|1 red onion, finely chopped|6 cloves garlic, minced|2 tbsp bagoong alamang|fish sauce or sea salt|freshly ground black pepper|oil","1)In a pan add oil then sauté garlic and onions|2)Add pork pieces and brown evenly.|3)Add the bagoong alamang and stir fry for a minute|4)Pour the coconut milk and add the squash and okra, bring to a boil then simmer for 8 minutes|5)Pour the coconut cream then add the kangkong and spinach then cook for 3 more minutes.|6)Season with pepper add fish sauce/salt if needed."
Porbidang Kangkong : Kangkong Leaves With Coconut Milk,1,0,1,340,11,0,0,35,3,6,1,4,2,2,0,,"1 large bunch of kangkong leaves. rinsed and cleaned|1 400 ml can coconut milk|1 200 ml can coconut cream|6 cloves garlic, minced|2 small shallots, minced|2–4 birds eye chillies, minced (adjust to your liking)|1 pc pork stock cube|fish sauce|oil|1/4 cup fried garlic, to garnish","1)Separate kangkong leaves and stems, chop the stems into smaller pieces.|2)In a wok sauté garlic and shallots in medium heat.|3)Add chillies, stir fry for 30 seconds.|4)Pour the coconut milk and add the pork cube, turn heat to high then bring it to a boil, let it boil until it slightly thickens and starts to render coconut oil.|5)Add the chopped stems, simmer for 90 seconds uncovered|6)Add the leaves then continue to simmer for one more minute.|7)Pour the coconut cream then simmer for one more minute, season with fish sauce then serve garnished with lots fried garlic on top."
Kulawong Talong : Grilled Eggplant With Burnt Coconut Cream,0,1,1,293,29,0,601,8,3,4,3,0,5,30,2,,"8 pcs Chinese eggplants|sea salt, to taste|250 g desiccated coconut thread|1 400 ml can coconut milk|1 200 ml can coconut cream|2 tbsp coconut or cane vinegar|2 pcs red chillies, chopped|6 cloves garlic, minced|1-inch piece ginger, thinly sliced|2 pcs shallots, finely chopped|fish sauce|freshly ground black pepper|oil","1)Using a fork, prick your eggplants across its surface, season your eggplants with salt then set it aside.|2)Prepare a charcoal grill or stove top grill then grill your eggplants with skin on until charred and cooked.|3)Let it cool then remove and discard the skin, set it aside.|4)In a bowl combine half of the coconut milk and the coconut thread, let the coconut thread absorb the milk then place it on a baking tray and bake in a 200C preheated oven until the coconut threads turn brown. Remove from oven then set aside.|5)In a large sauce pan add oil then sauté garlic, ginger and shallots.|6)Add the remaining coconut milk, coconut cream and the burnt coconut threads. Bring to a boil and let is simmer for 10 minutes in low heat.|7)Using a fine mesh sieve, strain the liquid and place on a separate sauce pan, add the eggplants slightly mashing it bring to a simmering heat, cook for 2 more minutes then season with fish sauce and freshly ground black pepper.|8)Top with chopped red chillies then serve"
Suam na Mais : Filipino Fresh Corn Soup,0,0,1,390,18,0,630,23,4,3,20,25,6,20,20,,1 cup corn meal| 1 cup corn cream| 1/2 cup coconut milk| 1 1/2 cups fresh grated coconut| 1 cup granulated white sugar|banana leaves,1)mix all the ingredients together...Blend well|2)wrap in banana leaves|3)steam for about 45 to 60 minutes or until done
Pork Bola Bola Soup with Misua and Patola,1,1,0,230,5,0,53,62,0,56,0,170,200,0,0,,3 ounces misua | 1 Knorr Pork cube | 1 medium patola sliced | ½ cup chopped scallion | 4 cloves garlic crushed | 1 medium yellow onion minced | 1/4 teaspoon ground black pepper | 2 tablespoons patis fish sauce | 6 to 8 cups water | 3 tablespoons cooking oil | Meatball ingredients: | 1 lb. ground pork | 1 egg | 1 medium yellow onion minced | 6 tablespoons all-purpose flour | 1 teaspoon salt | 1/4 teaspoon ground black pepper,"1) Prepare the meatballs by combining all meatball ingredients in a bowl. Mix well. Scoop 1 1/2 tablespoons of the mixture and form into a ball. Perform this step until the mixture is completely consumed. Set aside. | 2) Heat oil in a cooking pot. Once the oil becomes hot, pan fry the meatballs until the outer part turns light brown. Note: the meatballs do not need to be cooked completely at this point. | 3) Remove the meatballs from the pot. Set aside. | 4) Using the remaining oil, saute garlic until golden brown. Add onion. Continue to cook until the onion softens. | 5) Pour water. Let boil. Add the pan-fried meatballs back. | 6) Add Knorr Pork Cube. Stir. Cover the pot and cook in medium heat for 15 minutes. | 7) Add misua and patola. Cover and cook for 5 minutes. | 8) Season with patis and ground black pepper. Stir. | 9) Add scallions. Transfer to a serving bowl. | 10) Serve. Share and enjoy!"
Chicken Soup with Misua and Patola,1,1,1,240,10,0,55,61,0,56,100,173,210,0,0,,"6 to 8 ounces chicken breast | 2 ounces miswa flour noodle | 1 small patola luffa, sliced crosswise | 1 Knorr chicken cube | 1 cup hot pepper leaves | 1/2 cup chopped scallions | 3 cloves crushed garlic | 1 medium yellow onion chopped | 7 cups water | 2 tablespoons fish sauce | 1/4 teaspoon ground black pepper | 3 tablespoons cooking oil
","1) Pour 5 cups water in a cooking pot. Let boil. | 2) Add the chicken breast. Cover and then boil for 15 to 18 minutes in medium heat. | 3) Remove the chicken breast from the pot. Let it cool. Save the water (this is now the chicken stock) for later use. | 4) Discard the skin and separate the chicken meat from the bone. Shred the chicken using your hands. Set aside. | 5) Heat oil in the same cooking pot. | 6) Once the oil gets hot, saute the garlic until it turns light brown. | 7) Add the onion. Continue to saute until tender. | 8) Add the shredded chicken. Saute for 2 minutes. | 9) Pour the chicken stock into the pot (This is the water used to boil the chicken) and add the remaining water. Let boil. | 10) Add Knorr chicken cube. Stir. Cover and cook in medium heat for 12 minutes. | 11) Put the patola and hot pepper leaves in the cooking pot. Cook for 5 minutes. | 12) Add the miswa. Cook for 2 minutes. | 13) Add the scallions, fish sauce, and ground black pepper.Cook for 2 minutes. | 14)Transfer to a serving bowl. | 15) Serve. Share and enjoy!"
